"TID","EN","FR","DE","ES","IT","NL","NO","TR","JP","KR","RU","AR","PT","CN","CNT"
"string","string","string","string","string","string","string","string","string","string","string","string","string","string","string","string"
"TID_TENCENT_CREATE_NEW_ACCOUNT_CONFIRM_WECHAT","Your current progress is connected to another account. Are you sure you want to login and create a new game with this WeChat account?","Votre progression actuelle est liée à un autre compte. Voulez-vous vraiment vous reconnecter et créer une nouvelle partie avec ce compte WeChat ?","Dein aktueller Fortschritt ist mit einem anderen Konto verbunden. Möchtest du dich wirklich anmelden und ein neues Spiel mit diesem WeChat-Konto erstellen?","Tus progresos actuales están vinculados a otra cuenta. ¿Seguro que quieres conectarte y crear una nueva partida con esta cuenta de WeChat?","I tuoi progressi attuali sono collegati a un altro account. Sei sicuro di voler effettuare l'accesso e creare una nuova partita con questo account WeChat?","Je huidige voortgang is gekoppeld aan een ander account. Weet je zeker dat je je wilt aanmelden en een nieuw spel wilt maken met dit WeChat-account?","Den nåværende fremdriften din er tilknyttet en annen konto. Er du sikker på at du vil logge på og opprette et nytt spill med denne WeChat-kontoen?","Şimdiki ilerlemen başka bir hesaba bağlı. Bu WeChat hesabıyla giriş yapıp yeni bir oyun oluşturmak istiyor musun?","現在の進行状況は、別のアカウントに関連付けられています。このWeChatアカウントで、ログインと新規ゲームアカウントの作成を行いますか？","현재 진행 상황이 다른 계정에 연결되어 있습니다. 이 WeChat 계정으로 로그인해 게임을 새로 시작하시겠습니까?","Текущая игра привязана к другой учетной записи. Ты точно хочешь войти и создать новую игру с этой учетной записью WeChat?","مسار تقدمك الحالي مرتبط بحساب آخر. هل أنت متأكد من رغبتك في تسجيل الدخول وإنشاء لعبة جديدة بهذا الحساب على WeChat؟","Seu progresso atual está conectado a outra conta. Quer mesmo criar um novo jogo com a conta do WeChat?","您当前的游戏进度已经绑定了其他QQ/微信账号，您确定要登录新的QQ/微信账号并创建新的游戏进度吗？","您當前的遊戲進度已經綁定了其他微信帳號，您確定要登入新的微信帳號並創建新的遊戲進度嗎？"
"TID_TENCENT_CREATE_NEW_ACCOUNT_CONFIRM_QQ","Your current progress is connected to another account. Are you sure you want to login and create a new game with this QQ account?","Votre progression actuelle est liée à un autre compte. Voulez-vous vraiment vous reconnecter et créer une nouvelle partie avec ce compte QQ ?","Dein aktueller Fortschritt ist mit einem anderen Konto verbunden. Möchtest du dich wirklich anmelden und ein neues Spiel mit diesem QQ-Konto erstellen?","Tus progresos actuales están vinculados a otra cuenta. ¿Seguro que quieres conectarte y crear una nueva partida con esta cuenta de QQ?","I tuoi progressi attuali sono collegati a un altro account. Sei sicuro di voler effettuare l'accesso e creare una nuova partita con questo account QQ?","Je huidige voortgang is gekoppeld aan een ander account. Weet je zeker dat je je wilt aanmelden en een nieuw spel wilt maken met dit QQ-account?","Den nåværende fremdriften din er tilknyttet en annen konto. Er du sikker på at du vil logge på og opprette et nytt spill med denne QQ-kontoen?","Şimdiki ilerlemen başka bir hesaba bağlı. Bu QQ hesabıyla giriş yapıp yeni bir oyun oluşturmak istiyor musun?","現在の進行状況は、別のアカウントに関連付けられています。このQQアカウントで、ログインと新規ゲームアカウントの作成を行いますか？","현재 진행 상황이 다른 계정에 연결되어 있습니다. 이 QQ계정으로 로그인해 게임을 새로 시작하시겠습니까?","Текущая игра привязана к другой учетной записи. Ты точно хочешь войти и создать новую игру с этой учетной записью QQ?","مسار تقدمك الحالي مرتبط بحساب آخر. هل أنت متأكد من رغبتك في تسجيل الدخول وإنشاء لعبة جديدة بهذا الحساب على QQ؟","Seu progresso atual está conectado a outra conta. Quer mesmo criar um novo jogo com a conta do QQ?","您当前的游戏进度已经绑定了其他QQ/微信账号，您确定要登录新的QQ/微信账号并创建新的游戏进度吗？","您當前的遊戲進度已經綁定了其他QQ帳號，您確定要登入新的QQ帳號並創建新的遊戲進度嗎？"
"TID_TOURNAMENT_UNLOCK_LEVEL","Unlocks at level <number>","À débloquer au niveau <number>","Wird ab Level <number> freigeschaltet.","Se desbloquean en el nivel <number>.","Si sblocca al livello <number>","Ontgrendelen op level <number>","Låses opp på nivå <number>","Kilidi <number>. seviyede açılır","プレイヤーレベル<number>でアンロック","레벨 <number>에서 해제","Откроется на уровне <number>","تُفتح في المستوى <number>","Desbloqueia no nível <number>.","在第<number>级解锁","在第<number>級解鎖"
"TID_ACHIEVEMENT_INFO_TOURNAMENT","Win <num> cards from tournaments","Gagner <num> cartes dans les tournois","Gewinne <num> Karten in Turnieren.","Gana <num> cartas en torneos.","Vinci <num> carte da tornei","Win <num> kaarten via toernooien","Vinn <num> kort fra turneringer","Turnuvalardan <num> kart kazan","大会で<num>枚のカードを獲得する","토너먼트에서 카드 <num>장을 획득","Выиграй карты в турнирах (<num>)","اربح عدد <num> من البطاقات من البطولات","Ganhe <num> cartas em torneios","在锦标赛中赢得<num>张卡牌","在聯賽中贏得<num>張卡牌"
